script,title,link
中国外交部.py,习近平致电祝贺通伦当选连任老挝国家主席,https://www.fmprc.gov.cn/zyxw/202603/t20260323_11879308.shtml
中国外交部.py,赵乐际会见蒙古人民党代表团,https://www.fmprc.gov.cn/zyxw/202603/t20260323_11879372.shtml
中国外交部.py,赵乐际将出席博鳌亚洲论坛2026年年会,https://www.fmprc.gov.cn/zyxw/202603/t20260323_11879052.shtml
中国外交部.py,李强出席中国发展高层论坛2026年年会开幕式并发表主旨演讲,https://www.fmprc.gov.cn/zyxw/202603/t20260323_11878891.shtml
中国外交部.py,外交部部长助理兼礼宾司司长洪磊接受莫桑比克新任驻华大使递交国书副本,https://www.fmprc.gov.cn/wjbxw_new/202603/t20260323_11879426.shtml
中国外交部.py,赵乐际会见蒙古人民党代表团,https://www.fmprc.gov.cn/wjdt_674879/gjldrhd_674881/202603/t20260323_11879372.shtml
中国外交部.py,习近平致电祝贺通伦当选连任老挝国家主席,https://www.fmprc.gov.cn/wjdt_674879/gjldrhd_674881/202603/t20260323_11879308.shtml
中国外交部.py,李强出席中国发展高层论坛2026年年会开幕式并发表主旨演讲,https://www.fmprc.gov.cn/wjdt_674879/gjldrhd_674881/202603/t20260323_11878891.shtml
中国外交部.py,赵乐际将出席博鳌亚洲论坛2026年年会,https://www.fmprc.gov.cn/wjdt_674879/wsrc_674883/202603/t20260323_11879052.shtml
中国外交部.py,中国政府中东问题特使翟隽就当前中东局势向中外媒体吹风,https://www.fmprc.gov.cn/wjdt_674879/sjxw_674887/202603/t20260323_11879425.shtml
中国外交部.py,驻阿克托别总领事郭宇出席总领馆举办的领区疆籍华侨华人座谈会,https://www.fmprc.gov.cn/wjdt_674879/zwbd_674895/202603/t20260323_11879275.shtml
中国外交部.py,驻瓜亚基尔总领事高振廷出席2026瓜亚基尔春节中国电影节,https://www.fmprc.gov.cn/wjdt_674879/zwbd_674895/202603/t20260323_11879136.shtml
中国外交部.py,驻瑙鲁大使吕进同瑙总统阿迪昂举行工作会谈,https://www.fmprc.gov.cn/wjdt_674879/zwbd_674895/202603/t20260323_11879140.shtml
中国外交部.py,驻瑙鲁大使吕进同瑙总统阿迪昂举行工作会谈,https://www.fmprc.gov.cn/zwbd_673032/wshd_673034/202603/t20260323_11879140.shtml
中国外交部.py,驻瓜亚基尔总领事高振廷出席2026瓜亚基尔春节中国电影节,https://www.fmprc.gov.cn/zwbd_673032/whjl/202603/t20260323_11879136.shtml
中国外交部.py,驻阿克托别总领事郭宇出席总领馆举办的领区疆籍华侨华人座谈会,https://www.fmprc.gov.cn/zwbd_673032/jghd_673046/202603/t20260323_11879275.shtml
中国外交部.py,2026年3月23日外交部发言人林剑主持例行记者会,https://www.fmprc.gov.cn/fyrbt_673021/jzhsl_673025/202603/t20260323_11879269.shtml
国际海事组织.py,,
世界贸易组织.py,,
日本外务省.py,"Courtsey Call on State Minister for Foreign Affairs HORII by Mr. Toussaint, Director-General for Foreign Affairs, Ministry of Foreign Affairs and Worship of Haiti",https://www.mofa.go.jp/press/release/pressite_000001_02203.html
日本外务省.py,"Courtesy Call on Parliamentary Vice-Minister for Foreign Affairs ONISHI by H.E. Jamal bin Hassan Al-Moosawi, Secretary-General of the Oman National Museum",https://www.mofa.go.jp/press/release/pressite_000001_02202.html
日本外务省.py,Monitoring and surveillance activities by Canada against illicit maritime activities including ship-to-ship transfers,https://www.mofa.go.jp/press/release/pressite_000001_02200.html
联合国海洋法庭.py,,
国际海底管理局.py,,
战略与国际研究中心.py,"What is the ""Right to Repair?"" | All About the Base",https://www.csis.org/events/what-right-repair-all-about-base
美国国务院.py,,
美国运输部海事管理局.py,,
中国海事局.py,,
日本海上保安大学校.py,,
日本海上保安厅.py,官民連携救助アプリの運用を開始します！,https://www.kaiho.mlit.go.jp/info/kouhou/post-1296.html
太平洋岛国论坛.py,,
越南外交部.py,,
越南外交学院.py,,
中国国际电视台官微.py,,
南海之声.py,,
