script,title,link
中国外交部.py,习近平出席中法企业家委员会第七次会议闭幕式并致辞,https://www.fmprc.gov.cn/zyxw/202512/t20251204_11766513.shtml
中国外交部.py,习近平同法国总统马克龙共同会见记者,https://www.fmprc.gov.cn/zyxw/202512/t20251204_11766494.shtml
中国外交部.py,习近平同法国总统马克龙举行会谈,https://www.fmprc.gov.cn/zyxw/202512/t20251204_11766487.shtml
中国外交部.py,赵乐际会见法国总统马克龙,https://www.fmprc.gov.cn/zyxw/202512/t20251204_11766887.shtml
中国外交部.py,李强会见法国总统马克龙,https://www.fmprc.gov.cn/zyxw/202512/t20251204_11766869.shtml
中国外交部.py,彭丽媛同法国总统夫人布丽吉特参观北京人民艺术剧院,https://www.fmprc.gov.cn/zyxw/202512/t20251204_11766698.shtml
中国外交部.py,赵乐际会见法国总统马克龙,https://www.fmprc.gov.cn/wjdt_674879/gjldrhd_674881/202512/t20251204_11766887.shtml
中国外交部.py,李强会见法国总统马克龙,https://www.fmprc.gov.cn/wjdt_674879/gjldrhd_674881/202512/t20251204_11766869.shtml
中国外交部.py,彭丽媛同法国总统夫人布丽吉特参观北京人民艺术剧院,https://www.fmprc.gov.cn/wjdt_674879/gjldrhd_674881/202512/t20251204_11766698.shtml
中国外交部.py,习近平出席中法企业家委员会第七次会议闭幕式并致辞,https://www.fmprc.gov.cn/wjdt_674879/gjldrhd_674881/202512/t20251204_11766513.shtml
中国外交部.py,习近平同法国总统马克龙共同会见记者,https://www.fmprc.gov.cn/wjdt_674879/gjldrhd_674881/202512/t20251204_11766494.shtml
中国外交部.py,习近平同法国总统马克龙举行会谈,https://www.fmprc.gov.cn/wjdt_674879/gjldrhd_674881/202512/t20251204_11766487.shtml
中国外交部.py,驻哥伦比亚大使朱京阳出席第九届“对话中国”论坛,https://www.fmprc.gov.cn/wjdt_674879/zwbd_674895/202512/t20251204_11766645.shtml
中国外交部.py,驻哥伦比亚大使朱京阳拜会哥国会主席兼参议长加西亚,https://www.fmprc.gov.cn/wjdt_674879/zwbd_674895/202512/t20251204_11766646.shtml
中国外交部.py,驻刚果（布）大使安青出席中国—刚果（布）岐黄学院启动仪式,https://www.fmprc.gov.cn/wjdt_674879/zwbd_674895/202512/t20251204_11766658.shtml
中国外交部.py,驻曼彻斯特总领事唐锐参加基尔大学“林迈可纪念活动”,https://www.fmprc.gov.cn/wjdt_674879/zwbd_674895/202512/t20251204_11766650.shtml
中国外交部.py,驻墨西哥大使陈道江拜会墨新任众议长洛佩斯,https://www.fmprc.gov.cn/wjdt_674879/zwbd_674895/202512/t20251204_11766648.shtml
中国外交部.py,驻牙买加大使王锦峰出席“梅丽莎”飓风灾后中方现汇援助和物资交接仪式,https://www.fmprc.gov.cn/wjdt_674879/zwbd_674895/202512/t20251204_11766651.shtml
中国外交部.py,驻摩洛哥大使余劲松拜会摩旅游、手工业和社会团结经济大臣阿莫尔,https://www.fmprc.gov.cn/wjdt_674879/zwbd_674895/202512/t20251204_11766653.shtml
中国外交部.py,驻哥伦比亚大使朱京阳拜会哥国会主席兼参议长加西亚,https://www.fmprc.gov.cn/zwbd_673032/wshd_673034/202512/t20251204_11766646.shtml
中国外交部.py,驻墨西哥大使陈道江拜会墨新任众议长洛佩斯,https://www.fmprc.gov.cn/zwbd_673032/wshd_673034/202512/t20251204_11766648.shtml
中国外交部.py,驻牙买加大使王锦峰出席“梅丽莎”飓风灾后中方现汇援助和物资交接仪式,https://www.fmprc.gov.cn/zwbd_673032/wshd_673034/202512/t20251204_11766651.shtml
中国外交部.py,驻摩洛哥大使余劲松拜会摩旅游、手工业和社会团结经济大臣阿莫尔,https://www.fmprc.gov.cn/zwbd_673032/wshd_673034/202512/t20251204_11766653.shtml
中国外交部.py,驻里昂总领事于江出席深圳—里昂经贸交流会,https://www.fmprc.gov.cn/zwbd_673032/gzhd_673042/202512/t20251204_11766571.shtml
中国外交部.py,驻哥伦比亚大使朱京阳出席第九届“对话中国”论坛,https://www.fmprc.gov.cn/zwbd_673032/gzhd_673042/202512/t20251204_11766645.shtml
中国外交部.py,驻刚果（布）大使安青出席中国—刚果（布）岐黄学院启动仪式,https://www.fmprc.gov.cn/zwbd_673032/gzhd_673042/202512/t20251204_11766658.shtml
中国外交部.py,驻曼彻斯特总领事唐锐参加基尔大学“林迈可纪念活动”,https://www.fmprc.gov.cn/zwbd_673032/gzhd_673042/202512/t20251204_11766650.shtml
中国外交部.py,驻约旦大使郭伟会见约中友协主席,https://www.fmprc.gov.cn/zwbd_673032/gzhd_673042/202512/t20251204_11766655.shtml
中国外交部.py,驻阿尔及利亚大使董广利举行媒体吹风会宣介党的二十届四中全会精神,https://www.fmprc.gov.cn/zwbd_673032/gzhd_673042/202512/t20251204_11766656.shtml
中国外交部.py,驻阿尔及利亚大使董广利在宣介党的二十届四中全会精神媒体吹风会上的讲话实录,https://www.fmprc.gov.cn/zwbd_673032/wjzs/202512/t20251204_11766652.shtml
中国外交部.py,2025年12月4日外交部发言人林剑主持例行记者会,https://www.fmprc.gov.cn/fyrbt_673021/jzhsl_673025/202512/t20251204_11766635.shtml
国际海事组织.py,,
世界贸易组织.py,,
日本外务省.py,"Courtesy Call on State Minister KUNIMITSU by Dr. NAKAJIMA Yuko, President, Doctors Without Borders / Médecins Sans Frontières (MSF) Japan",https://www.mofa.go.jp/press/release/pressite_000001_01891.html
日本外务省.py,The 1st Japan-Viet Nam Foreign and Defence Vice-Ministerial Consultation (2+2),https://www.mofa.go.jp/press/release/pressite_000001_01890.html
联合国海洋法庭.py,,
国际海底管理局.py,,
战略与国际研究中心.py,The Future of the EIA: A Conversation with Administrator Tristan Abbey,https://www.csis.org/events/future-eia-conversation-administrator-tristan-abbey
战略与国际研究中心.py,Security Challenges in the Caribbean Amid the U.S. Military Deployment,https://www.csis.org/analysis/security-challenges-caribbean-amid-us-military-deployment
战略与国际研究中心.py,The Future of the EIA: A Conversation with Administrator Tristan Abbey,https://www.csis.org/events/future-eia-conversation-administrator-tristan-abbey
美国国务院.py,Responding to Hurricane Melissa,https://www.state.gov/responding-to-hurricane-melissa?utm_source=homepage&utm_medium=newsbar&utm_campaign=melissa
美国运输部海事管理局.py,,
中国海事局.py,,
日本海上保安大学校.py,,
日本海上保安厅.py,,
太平洋岛国论坛.py,,
越南外交部.py,Đối thoại 2+2 Ngoại giao - Quốc phòng cấp Thứ trưởng lần đầu tiên giữa Việt Nam và Nhật Bản,https://mofa.gov.vn/vi/tin-chi-tiet/chi-tiet/doi-thoai-2-2-ngoai-giao-quoc-phong-cap-thu-truong-lan-dau-tien-giua-viet-nam-va-nhat-ban-58147-139.html
越南外交学院.py,,
中国国际电视台官微.py,,
南海之声.py,,
