script,title,link
中国外交部.py,外交部副部长苗得雨会见伊朗外交部副部长加里布阿巴迪,https://www.fmprc.gov.cn/wjbxw_new/202602/t20260206_11852492.shtml
中国外交部.py,驻奥克兰总领事陈世杰出席总领馆举行的“温暖迎春·共庆中国年”2026年春节招待会,https://www.fmprc.gov.cn/wjdt_674879/zwbd_674895/202602/t20260206_11852522.shtml
中国外交部.py,驻伊尔库茨克总领事刘渝访问后贝加尔边疆区,https://www.fmprc.gov.cn/wjdt_674879/zwbd_674895/202602/t20260206_11852554.shtml
中国外交部.py,驻墨尔本总领事房新文祝贺张帅获得2026澳大利亚网球公开赛女双冠军,https://www.fmprc.gov.cn/wjdt_674879/zwbd_674895/202602/t20260206_11852582.shtml
中国外交部.py,驻牙买加大使王锦峰出席“温暖迎春”新春茶话会暨领事协助志愿者委任仪式,https://www.fmprc.gov.cn/wjdt_674879/zwbd_674895/202602/t20260206_11852573.shtml
中国外交部.py,驻奥克兰总领事陈世杰出席奥克兰孔子学院国际中文志愿者培训结业式,https://www.fmprc.gov.cn/wjdt_674879/zwbd_674895/202602/t20260206_11852586.shtml
中国外交部.py,驻斐济使馆临时代办汪元礼节性拜会斐外交和对外贸易部长迪托卡,https://www.fmprc.gov.cn/wjdt_674879/zwbd_674895/202602/t20260206_11852593.shtml
中国外交部.py,驻格林纳达大使杨舒走访慰问在格侨胞,https://www.fmprc.gov.cn/wjdt_674879/zwbd_674895/202602/t20260206_11852601.shtml
中国外交部.py,驻特立尼达和多巴哥大使任洪岩会见第78届联大主席弗朗西斯,https://www.fmprc.gov.cn/zwbd_673032/wshd_673034/202602/t20260206_11852570.shtml
中国外交部.py,驻伊尔库茨克总领事刘渝访问后贝加尔边疆区,https://www.fmprc.gov.cn/zwbd_673032/wshd_673034/202602/t20260206_11852554.shtml
中国外交部.py,驻斐济使馆临时代办汪元礼节性拜会斐外交和对外贸易部长迪托卡,https://www.fmprc.gov.cn/zwbd_673032/wshd_673034/202602/t20260206_11852593.shtml
中国外交部.py,驻蒙特利尔总领事戴玉明出席魁北克省领团年会,https://www.fmprc.gov.cn/zwbd_673032/wshd_673034/202602/t20260206_11852560.shtml
中国外交部.py,驻阿尔及利亚大使董广利会见阿民族民主联盟总书记布登,https://www.fmprc.gov.cn/zwbd_673032/wshd_673034/202602/t20260206_11852565.shtml
中国外交部.py,驻蒙特利尔总领事戴玉明与魁省国关厅举行季度磋商,https://www.fmprc.gov.cn/zwbd_673032/wshd_673034/202602/t20260206_11852563.shtml
中国外交部.py,驻开普敦总领事任发强出席领警侨三方会议,https://www.fmprc.gov.cn/zwbd_673032/wshd_673034/202602/t20260206_11852566.shtml
中国外交部.py,驻南苏丹大使马强出席使馆举办的2026年春节招待会,https://www.fmprc.gov.cn/zwbd_673032/gzhd_673042/202602/t20260206_11852544.shtml
中国外交部.py,驻墨尔本总领事房新文祝贺张帅获得2026澳大利亚网球公开赛女双冠军,https://www.fmprc.gov.cn/zwbd_673032/gzhd_673042/202602/t20260206_11852582.shtml
中国外交部.py,驻多米尼加大使陈鲁宁会见胡安·博什基金会主席,https://www.fmprc.gov.cn/zwbd_673032/gzhd_673042/202602/t20260206_11852589.shtml
中国外交部.py,驻安哥拉大使张斌出席使馆举办的2026年春节招待会,https://www.fmprc.gov.cn/zwbd_673032/gzhd_673042/202602/t20260206_11852533.shtml
中国外交部.py,驻蒙特利尔总领事戴玉明会见拉瓦尔大学副校长,https://www.fmprc.gov.cn/zwbd_673032/gzhd_673042/202602/t20260206_11852549.shtml
中国外交部.py,驻安哥拉大使张斌在2026年春节招待会上的致辞,https://www.fmprc.gov.cn/zwbd_673032/wjzs/202602/t20260206_11852525.shtml
中国外交部.py,驻马耳他大使张佐出席“欢乐春节”中国艺术团与马尔萨斯卡拉市圣约阿希姆小学学生联欢活动,https://www.fmprc.gov.cn/zwbd_673032/whjl/202602/t20260206_11852545.shtml
中国外交部.py,驻格林纳达大使杨舒走访慰问在格侨胞,https://www.fmprc.gov.cn/zwbd_673032/jghd_673046/202602/t20260206_11852601.shtml
中国外交部.py,驻拉各斯总领事严宇清出席领区中资企业新年座谈会,https://www.fmprc.gov.cn/zwbd_673032/jghd_673046/202602/t20260206_11852557.shtml
中国外交部.py,驻奥克兰总领事陈世杰出席奥克兰孔子学院国际中文志愿者培训结业式,https://www.fmprc.gov.cn/zwbd_673032/jghd_673046/202602/t20260206_11852586.shtml
中国外交部.py,驻牙买加大使王锦峰出席“温暖迎春”新春茶话会暨领事协助志愿者委任仪式,https://www.fmprc.gov.cn/zwbd_673032/jghd_673046/202602/t20260206_11852573.shtml
中国外交部.py,驻古巴大使华昕出席在古中资机构新春茶话会,https://www.fmprc.gov.cn/zwbd_673032/jghd_673046/202602/t20260206_11852569.shtml
中国外交部.py,驻开普敦总领事任发强出席开普敦地区华侨华人旅行社座谈会,https://www.fmprc.gov.cn/zwbd_673032/jghd_673046/202602/t20260206_11852567.shtml
中国外交部.py,2026年2月6日外交部发言人林剑主持例行记者会,https://www.fmprc.gov.cn/fyrbt_673021/jzhsl_673025/202602/t20260206_11852777.shtml
国际海事组织.py,,
世界贸易组织.py,,
日本外务省.py,The 11th Japan-ROK Director-General Consultations on the Middle East,https://www.mofa.go.jp/press/release/pressite_000001_02058.html
日本外务省.py,Signing of the Japan-Bangladesh Economic Partnership Agreement,https://www.mofa.go.jp/press/release/pressite_000001_02057.html
日本外务省.py,OECD-Southeast Asia Policy Roundtable: Strengthening Economic Security for Prosperity in Southeast Asia: Policy Insights from Strategic Industries (Results),https://www.mofa.go.jp/press/release/pressite_000001_02056.html
日本外务省.py,Grant Aid to the Lao People's Democratic Republic: Signing and Exchange of Notes on “the Economic and Social Development Programme”,https://www.mofa.go.jp/press/release/pressite_000001_02055.html
日本外务省.py,Dispatch of Election Observer Mission to the People's Republic of Bangladesh for General Election,https://www.mofa.go.jp/press/release/pressite_000001_02054.html
联合国海洋法庭.py,,
国际海底管理局.py,,
战略与国际研究中心.py,"Energy Shots: India, Iran, Talks and Shocks",https://www.csis.org/events/energy-shots-india-iran-talks-and-shocks
战略与国际研究中心.py,"Energy Shots: India, Iran, Talks and Shocks",https://www.csis.org/events/energy-shots-india-iran-talks-and-shocks
美国国务院.py,,
美国运输部海事管理局.py,,
中国海事局.py,,
日本海上保安大学校.py,,
日本海上保安厅.py,海図の価格改定について～令和8年4月1日から新価格が適用されます～,https://www.kaiho.mlit.go.jp/info/kouhou/post-1285.html
太平洋岛国论坛.py,REPORT: Gender Equality in the Blue Pacific,https://forumsec.org/publications/report-gender-equality-blue-pacific
越南外交部.py,,
越南外交学院.py,,
中国国际电视台官微.py,,
南海之声.py,,
