script,title,link
中国外交部.py,国家主席习近平任免驻外大使,https://www.fmprc.gov.cn/zyxw/202511/t20251126_11760551.shtml
中国外交部.py,习近平向“声援巴勒斯坦人民国际日”纪念大会致贺电,https://www.fmprc.gov.cn/zyxw/202511/t20251126_11760372.shtml
中国外交部.py,中华人民共和国和汤加王国联合声明（全文）,https://www.fmprc.gov.cn/zyxw/202511/t20251126_11760580.shtml
中国外交部.py,李强会见汤加国王图普六世,https://www.fmprc.gov.cn/zyxw/202511/t20251126_11760858.shtml
中国外交部.py,赵乐际会见汤加国王图普六世,https://www.fmprc.gov.cn/zyxw/202511/t20251126_11760428.shtml
中国外交部.py,李强会见汤加国王图普六世,https://www.fmprc.gov.cn/wjdt_674879/gjldrhd_674881/202511/t20251126_11760858.shtml
中国外交部.py,赵乐际会见汤加国王图普六世,https://www.fmprc.gov.cn/wjdt_674879/gjldrhd_674881/202511/t20251126_11760428.shtml
中国外交部.py,习近平向“声援巴勒斯坦人民国际日”纪念大会致贺电,https://www.fmprc.gov.cn/wjdt_674879/gjldrhd_674881/202511/t20251126_11760372.shtml
中国外交部.py,中国政府拉美事务特别代表邱小琪出席第十四届中拉高层学术论坛,https://www.fmprc.gov.cn/wjdt_674879/sjxw_674887/202511/t20251126_11760654.shtml
中国外交部.py,外交部中国—中东欧国家合作事务特别代表陈国友访问黑山,https://www.fmprc.gov.cn/wjdt_674879/sjxw_674887/202511/t20251126_11760318.shtml
中国外交部.py,国家主席习近平任免驻外大使,https://www.fmprc.gov.cn/wjdt_674879/dsrm_674893/202511/t20251126_11760551.shtml
中国外交部.py,驻伊尔库茨克总领事刘渝走访调研领区部分中资企业,https://www.fmprc.gov.cn/wjdt_674879/zwbd_674895/202511/t20251126_11760521.shtml
中国外交部.py,驻古巴大使华昕出席2025年哈瓦那国际博览会中国日活动并致辞,https://www.fmprc.gov.cn/wjdt_674879/zwbd_674895/202511/t20251126_11760522.shtml
中国外交部.py,驻哥伦比亚大使朱京阳会见哥贸易投资旅游局局长卡瓦列罗,https://www.fmprc.gov.cn/wjdt_674879/zwbd_674895/202511/t20251126_11760523.shtml
中国外交部.py,驻哥伦比亚大使朱京阳会见联合国哥伦比亚核查团团长延恰,https://www.fmprc.gov.cn/wjdt_674879/zwbd_674895/202511/t20251126_11760524.shtml
中国外交部.py,驻哥伦比亚大使朱京阳拜会哥外长比利亚维森西奥,https://www.fmprc.gov.cn/wjdt_674879/zwbd_674895/202511/t20251126_11760525.shtml
中国外交部.py,驻冰岛大使何儒龙赴冰岛马瑞奥公司调研,https://www.fmprc.gov.cn/wjdt_674879/zwbd_674895/202511/t20251126_11760526.shtml
中国外交部.py,驻格林纳达大使杨舒拜会格经济发展部长安德鲁斯,https://www.fmprc.gov.cn/wjdt_674879/zwbd_674895/202511/t20251126_11760472.shtml
中国外交部.py,驻哥伦比亚大使朱京阳会见联合国哥伦比亚核查团团长延恰,https://www.fmprc.gov.cn/zwbd_673032/wshd_673034/202511/t20251126_11760524.shtml
中国外交部.py,驻格林纳达大使杨舒拜会格经济发展部长安德鲁斯,https://www.fmprc.gov.cn/zwbd_673032/wshd_673034/202511/t20251126_11760472.shtml
中国外交部.py,驻利比里亚大使尹承武拜会利临时参议长劳伦斯,https://www.fmprc.gov.cn/zwbd_673032/wshd_673034/202511/t20251126_11760518.shtml
中国外交部.py,驻墨西哥大使陈道江会见联合国妇女署驻墨西哥代表皮扎尼,https://www.fmprc.gov.cn/zwbd_673032/wshd_673034/202511/t20251126_11760515.shtml
中国外交部.py,驻拉合尔总领事赵世人拜会旁遮普省首席秘书扎曼,https://www.fmprc.gov.cn/zwbd_673032/wshd_673034/202511/t20251126_11760441.shtml
中国外交部.py,驻哥伦比亚大使朱京阳会见哥贸易投资旅游局局长卡瓦列罗,https://www.fmprc.gov.cn/zwbd_673032/wshd_673034/202511/t20251126_11760523.shtml
中国外交部.py,驻哥伦比亚大使朱京阳拜会哥外长比利亚维森西奥,https://www.fmprc.gov.cn/zwbd_673032/wshd_673034/202511/t20251126_11760525.shtml
中国外交部.py,驻古巴大使华昕出席2025年哈瓦那国际博览会中国日活动并致辞,https://www.fmprc.gov.cn/zwbd_673032/gzhd_673042/202511/t20251126_11760522.shtml
中国外交部.py,驻冰岛大使何儒龙赴冰岛马瑞奥公司调研,https://www.fmprc.gov.cn/zwbd_673032/gzhd_673042/202511/t20251126_11760526.shtml
中国外交部.py,驻特立尼达和多巴哥大使任洪岩出席2025年度“中国大使奖学金”颁奖仪式,https://www.fmprc.gov.cn/zwbd_673032/gzhd_673042/202511/t20251126_11760516.shtml
中国外交部.py,驻伊尔库茨克总领事刘渝走访调研领区部分中资企业,https://www.fmprc.gov.cn/zwbd_673032/jghd_673046/202511/t20251126_11760521.shtml
中国外交部.py,2025年11月26日外交部发言人毛宁主持例行记者会,https://www.fmprc.gov.cn/fyrbt_673021/jzhsl_673025/202511/t20251126_11760587.shtml
中国外交部.py,中华人民共和国和汤加王国联合声明（全文）,https://www.mfa.gov.cn/web/ziliao_674904/1179_674909/202511/t20251126_11760580.shtml
国际海事组织.py,,
世界贸易组织.py,Government Procurement Committee adopts decision to enhance transparency of its work,https://www.wto.org/english/news_e/news25_e/gpro_26nov25_216_e.htm
日本外务省.py,"Working Dinner between Minister for Foreign Affairs MOTEGI and H.H. Mr. Gaolathe, Vice President and Minister of Finance of the Republic of Botswana",https://www.mofa.go.jp/press/release/pressite_000001_01856.html
联合国海洋法庭.py,,
战略与国际研究中心.py,,
美国国务院.py,Responding to Hurricane Melissa,https://www.state.gov/responding-to-hurricane-melissa?utm_source=homepage&utm_medium=newsbar&utm_campaign=melissa
美国运输部海事管理局.py,,
中国海事局.py,,
日本海上保安大学校.py,,
日本海上保安厅.py,,
太平洋岛国论坛.py,,
越南外交部.py,Phó Thủ tướng Chính phủ Trần Hồng Hà thăm chính thức New Zealand và Australia,https://mofa.gov.vn/vi/tin-chi-tiet/chi-tiet/pho-thu-tuong-chinh-phu-tran-hong-ha-tham-chinh-thuc-new-zealand-va-australia-58041-139.html
越南外交部.py,Thông báo,https://mofa.gov.vn/vi/tin-chi-tiet/chi-tiet/thong-bao-58039-139.html
越南外交学院.py,,
中国国际电视台官微.py,,
南海之声.py,,
