script,title,link
中国外交部.py,蔡奇会见蒙古人民党代表团,https://www.fmprc.gov.cn/zyxw/202603/t20260324_11879793.shtml
中国外交部.py,韩正出席肯尼亚享受零关税出口中国商品展示会暨中国－肯尼亚商务论坛并致辞,https://www.fmprc.gov.cn/zyxw/202603/t20260324_11879791.shtml
中国外交部.py,外交部副部长苗得雨会见世界知识产权组织总干事邓鸿森,https://www.fmprc.gov.cn/wjbxw_new/202603/t20260324_11880211.shtml
中国外交部.py,外交部部长助理刘彬会见联合国副秘书长、裁军事务高级代表中满泉,https://www.fmprc.gov.cn/wjbxw_new/202603/t20260324_11880188.shtml
中国外交部.py,外交部部长助理刘彬会见哈萨克斯坦常驻联合国代表乌马洛夫,https://www.fmprc.gov.cn/wjbxw_new/202603/t20260324_11880186.shtml
中国外交部.py,​外交部副部长苗得雨会见利比亚民族统一政府总理特使阿卜杜勒马吉德,https://www.fmprc.gov.cn/wjbxw_new/202603/t20260324_11880086.shtml
中国外交部.py,​外交部部长助理刘彬会见亚信秘书长萨雷拜,https://www.fmprc.gov.cn/wjbxw_new/202603/t20260324_11879771.shtml
中国外交部.py,外交部副部长苗得雨出席纳米比亚独立36周年招待会,https://www.fmprc.gov.cn/wjbxw_new/202603/t20260324_11879769.shtml
中国外交部.py,蔡奇会见蒙古人民党代表团,https://www.fmprc.gov.cn/wjdt_674879/gjldrhd_674881/202603/t20260324_11879793.shtml
中国外交部.py,韩正出席肯尼亚享受零关税出口中国商品展示会暨中国－肯尼亚商务论坛并致辞,https://www.fmprc.gov.cn/wjdt_674879/gjldrhd_674881/202603/t20260324_11879791.shtml
中国外交部.py,中国政府中东问题特使翟隽会见以色列驻华大使贝以理,https://www.fmprc.gov.cn/wjdt_674879/sjxw_674887/202603/t20260324_11880182.shtml
中国外交部.py,驻奥克兰总领事陈世杰出席怀卡托热气球节开幕式,https://www.fmprc.gov.cn/wjdt_674879/zwbd_674895/202603/t20260324_11879976.shtml
中国外交部.py,驻哥伦比亚大使朱京阳就习近平主席向拉共体峰会致贺电接受当地媒体采访,https://www.fmprc.gov.cn/wjdt_674879/zwbd_674895/202603/t20260324_11879990.shtml
中国外交部.py,驻津巴布韦大使周鼎出席对津粮食援助交接仪式,https://www.fmprc.gov.cn/wjdt_674879/zwbd_674895/202603/t20260324_11880014.shtml
中国外交部.py,驻里约热内卢总领事田敏出席总领馆举办的两会媒体专家吹风会,https://www.fmprc.gov.cn/wjdt_674879/zwbd_674895/202603/t20260324_11879909.shtml
中国外交部.py,驻牙买加大使王锦峰在牙媒体《集锦报》发表题为《共享中国式现代化发展机遇，共建人类命运共同体》的署名文章,https://www.fmprc.gov.cn/wjdt_674879/zwbd_674895/202603/t20260324_11880001.shtml
中国外交部.py,驻多米尼克大使储茂明出席使馆举行的2026年全国两会媒体吹风会,https://www.fmprc.gov.cn/wjdt_674879/zwbd_674895/202603/t20260324_11879894.shtml
中国外交部.py,驻南苏丹大使马强出席南苏丹基础教育与指导部小学教材发放仪式,https://www.fmprc.gov.cn/wjdt_674879/zwbd_674895/202603/t20260324_11879900.shtml
中国外交部.py,驻津巴布韦大使周鼎出席对津粮食援助交接仪式,https://www.fmprc.gov.cn/zwbd_673032/wshd_673034/202603/t20260324_11880014.shtml
中国外交部.py,驻也门使馆临时代办邵峥会见也石油部长顾问马哈福兹,https://www.fmprc.gov.cn/zwbd_673032/wshd_673034/202603/t20260324_11879925.shtml
中国外交部.py,驻马耳他大使张佐拜会马教育体育青年部长格里马,https://www.fmprc.gov.cn/zwbd_673032/wshd_673034/202603/t20260324_11880006.shtml
中国外交部.py,驻南苏丹大使马强出席南苏丹基础教育与指导部小学教材发放仪式,https://www.fmprc.gov.cn/zwbd_673032/gzhd_673042/202603/t20260324_11879900.shtml
中国外交部.py,驻奥克兰总领事陈世杰出席怀卡托热气球节开幕式,https://www.fmprc.gov.cn/zwbd_673032/gzhd_673042/202603/t20260324_11879976.shtml
中国外交部.py,驻哥伦比亚大使朱京阳就习近平主席向拉共体峰会致贺电接受当地媒体采访,https://www.fmprc.gov.cn/zwbd_673032/gzhd_673042/202603/t20260324_11879990.shtml
中国外交部.py,驻里约热内卢总领事田敏出席总领馆举办的两会媒体专家吹风会,https://www.fmprc.gov.cn/zwbd_673032/gzhd_673042/202603/t20260324_11879909.shtml
中国外交部.py,驻多米尼克大使储茂明出席使馆举行的2026年全国两会媒体吹风会,https://www.fmprc.gov.cn/zwbd_673032/gzhd_673042/202603/t20260324_11879894.shtml
中国外交部.py,驻荷兰大使申博会见商品共同基金组织负责人,https://www.fmprc.gov.cn/zwbd_673032/gzhd_673042/202603/t20260324_11879931.shtml
中国外交部.py,驻法国大使邓励出席巴黎法中友协举行成立30周年庆祝活动,https://www.fmprc.gov.cn/zwbd_673032/gzhd_673042/202603/t20260324_11879967.shtml
中国外交部.py,驻牙买加大使王锦峰在牙媒体《集锦报》发表题为《共享中国式现代化发展机遇，共建人类命运共同体》的署名文章,https://www.fmprc.gov.cn/zwbd_673032/wjzs/202603/t20260324_11880001.shtml
中国外交部.py,驻法国大使邓励在巴黎法中友协成立30周年庆祝活动上的致辞,https://www.fmprc.gov.cn/zwbd_673032/wjzs/202603/t20260324_11879958.shtml
中国外交部.py,驻哥斯达黎加大使王晓瑶在哥媒发表署名文章《稳定、发展与机遇：中国两会的时代信号》,https://www.fmprc.gov.cn/zwbd_673032/wjzs/202603/t20260324_11879954.shtml
中国外交部.py,驻巴塞罗那总领事孟宇宏在《三角报》发表署名文章《文明对话弘扬人类共同价值，中西合作谱写友谊新篇章》,https://www.fmprc.gov.cn/zwbd_673032/wjzs/202603/t20260324_11879975.shtml
中国外交部.py,驻利比里亚大使尹承武在利媒体发表署名文章《零关税深化合作，新机遇惠及中非》,https://www.fmprc.gov.cn/zwbd_673032/wjzs/202603/t20260324_11880003.shtml
中国外交部.py,驻挪威大使侯悦出席2026年“国际中文日”,https://www.fmprc.gov.cn/zwbd_673032/whjl/202603/t20260324_11880005.shtml
中国外交部.py,驻阿尔及利亚大使董广利赴援阿青年文化宫项目现场考察,https://www.fmprc.gov.cn/zwbd_673032/jghd_673046/202603/t20260324_11879896.shtml
中国外交部.py,驻爱尔兰大使赵希源出席使馆举办的学习2026年全国两会精神侨界座谈会,https://www.fmprc.gov.cn/zwbd_673032/jghd_673046/202603/t20260324_11880004.shtml
中国外交部.py,2026年3月24日外交部发言人林剑主持例行记者会,https://www.fmprc.gov.cn/fyrbt_673021/jzhsl_673025/202603/t20260324_11880190.shtml
国际海事组织.py,,
世界贸易组织.py,,
日本外务省.py,Working Dinner between State Minister for Foreign Affairs HORII and Minister Romero of the Plurinational State of Bolivia,https://www.mofa.go.jp/press/release/pressite_000001_02205.html
日本外务省.py,The second meeting under “Strategic Partnership Framework between Japan and MERCOSUR”,https://www.mofa.go.jp/press/release/pressite_000001_02204.html
联合国海洋法庭.py,,
国际海底管理局.py,,
战略与国际研究中心.py,What Are the Hidden Costs of the War with Iran? | State of Play,https://www.csis.org/events/what-are-hidden-costs-war-iran-state-play
战略与国际研究中心.py,What Are the Hidden Costs of the War with Iran? | State of Play,https://www.csis.org/events/what-are-hidden-costs-war-iran-state-play
美国国务院.py,Secretary Rubio’s Travel to France,https://www.state.gov/releases/office-of-the-spokesperson/2026/03/secretary-rubios-travel-to-france/?utm_source=homepage&utm_medium=news_bar&utm_campaign=s_travel
美国运输部海事管理局.py,,
中国海事局.py,,
日本海上保安大学校.py,,
日本海上保安厅.py,,
太平洋岛国论坛.py,REPORT: The Pacific Regional Private Sector Strategy,https://forumsec.org/publications/report-pacific-regional-private-sector-strategy
越南外交部.py,Thủ tướng Chính phủ Phạm Minh Chính hội đàm với Thủ tướng Liên Nga Mikhail Mishustin,https://mofa.gov.vn/tin-chi-tiet/chi-tiet/thu-tuong-chinh-phu-pham-minh-chinh-hoi-dam-voi-thu-tuong-lien-nga-mikhail-mishustin-59158-138.html
越南外交部.py,Phó Thủ tướng Chính phủ Hồ Đức Phớc tiếp Cao ủy Liên minh Châu Âu (EU) về Đối tác quốc tế Jozef...,https://mofa.gov.vn/vi/tin-chi-tiet/chi-tiet/pho-thu-tuong-chinh-phu-ho-duc-phoc-tiep-cao-uy-lien-minh-chau-au-eu-ve-doi-tac-quoc-te-jozef-sikela-59165-139.html
越南外交学院.py,,
中国国际电视台官微.py,,
南海之声.py,,
