script,title,link
中国外交部.py,习近平总书记特使访问越南,https://www.fmprc.gov.cn/zyxw/202601/t20260130_11848319.shtml
中国外交部.py,习近平总书记特使访问越南,https://www.fmprc.gov.cn/wjdt_674879/gjldrhd_674881/202601/t20260130_11848319.shtml
中国外交部.py,中俄举行首次海外公民安全事务磋商,https://www.fmprc.gov.cn/wjdt_674879/sjxw_674887/202601/t20260130_11848349.shtml
中国外交部.py,落实《南海各方行为宣言》第25次高官会在菲律宾宿务举行,https://www.fmprc.gov.cn/wjdt_674879/sjxw_674887/202601/t20260130_11847989.shtml
中国外交部.py,驻古巴大使华昕出席“欢乐春节·博物馆里过大年”特展开幕式,https://www.fmprc.gov.cn/wjdt_674879/zwbd_674895/202601/t20260130_11847947.shtml
中国外交部.py,驻克赖斯特彻奇总领事何颖会见克赖斯特彻奇市市长菲尔·梅杰,https://www.fmprc.gov.cn/wjdt_674879/zwbd_674895/202601/t20260130_11847965.shtml
中国外交部.py,驻巴拿马大使徐学渊访问巴拿马美洲专业大学,https://www.fmprc.gov.cn/wjdt_674879/zwbd_674895/202601/t20260130_11847938.shtml
中国外交部.py,驻拉各斯总领事严宇清拜会新任尼经济和金融犯罪委员会拉各斯办事处主任,https://www.fmprc.gov.cn/wjdt_674879/zwbd_674895/202601/t20260130_11847936.shtml
中国外交部.py,驻巴西大使祝青桥出席中巴农业机械设备研发创新研讨会,https://www.fmprc.gov.cn/wjdt_674879/zwbd_674895/202601/t20260130_11847934.shtml
中国外交部.py,驻美国大使谢锋在2026“欢乐春节”音乐会暨“你好！中国” 旅游推介活动上的致辞——以人文交流为桥、为媒、为镜， 助力中美构建新时期正确相处之道,https://www.fmprc.gov.cn/wjdt_674879/zwbd_674895/202601/t20260130_11847930.shtml
中国外交部.py,驻美国大使谢锋出席2026“欢乐春节”音乐会暨“你好！中国”旅游推介活动,https://www.fmprc.gov.cn/wjdt_674879/zwbd_674895/202601/t20260130_11847941.shtml
中国外交部.py,驻斯洛文尼亚大使康艳拜会斯前总统图尔克,https://www.fmprc.gov.cn/zwbd_673032/wshd_673034/202601/t20260130_11847967.shtml
中国外交部.py,驻克赖斯特彻奇总领事何颖会见克赖斯特彻奇市市长菲尔·梅杰,https://www.fmprc.gov.cn/zwbd_673032/wshd_673034/202601/t20260130_11847965.shtml
中国外交部.py,驻拉各斯总领事严宇清拜会新任尼经济和金融犯罪委员会拉各斯办事处主任,https://www.fmprc.gov.cn/zwbd_673032/gzhd_673042/202601/t20260130_11847936.shtml
中国外交部.py,驻巴拿马大使徐学渊访问巴拿马美洲专业大学,https://www.fmprc.gov.cn/zwbd_673032/gzhd_673042/202601/t20260130_11847938.shtml
中国外交部.py,驻巴西大使祝青桥出席中巴农业机械设备研发创新研讨会,https://www.fmprc.gov.cn/zwbd_673032/gzhd_673042/202601/t20260130_11847934.shtml
中国外交部.py,驻葡萄牙大使杨义瑞会见葡投资和对外贸易署主席席尔瓦,https://www.fmprc.gov.cn/zwbd_673032/gzhd_673042/202601/t20260130_11847971.shtml
中国外交部.py,驻美国大使谢锋在2026“欢乐春节”音乐会暨“你好！中国” 旅游推介活动上的致辞——以人文交流为桥、为媒、为镜， 助力中美构建新时期正确相处之道,https://www.fmprc.gov.cn/zwbd_673032/wjzs/202601/t20260130_11847930.shtml
中国外交部.py,驻阿尔及利亚大使董广利在2026“阿尔及尔·欢乐春节”文艺演出上的致辞,https://www.fmprc.gov.cn/zwbd_673032/wjzs/202601/t20260130_11847979.shtml
中国外交部.py,驻古巴大使华昕出席“欢乐春节·博物馆里过大年”特展开幕式,https://www.fmprc.gov.cn/zwbd_673032/whjl/202601/t20260130_11847947.shtml
中国外交部.py,驻美国大使谢锋出席2026“欢乐春节”音乐会暨“你好！中国”旅游推介活动,https://www.fmprc.gov.cn/zwbd_673032/whjl/202601/t20260130_11847941.shtml
中国外交部.py,驻阿尔及利亚大使董广利出席2026“欢乐春节”系列活动,https://www.fmprc.gov.cn/zwbd_673032/whjl/202601/t20260130_11848033.shtml
中国外交部.py,驻荷兰大使申博出席2026年“欢乐春节”新年音乐会,https://www.fmprc.gov.cn/zwbd_673032/whjl/202601/t20260130_11848040.shtml
中国外交部.py,驻米兰总领事刘侃出席总领馆举办的2026年“温暖迎春·共庆中国年”新春暖心包发放仪式,https://www.fmprc.gov.cn/zwbd_673032/jghd_673046/202601/t20260130_11848038.shtml
中国外交部.py,2026年1月30日外交部发言人郭嘉昆主持例行记者会,https://www.fmprc.gov.cn/fyrbt_673021/jzhsl_673025/202601/t20260130_11848280.shtml
国际海事组织.py,,
世界贸易组织.py,Government Procurement Agreement thresholds updated for 2026&ndash;2027,https://www.wto.org/english/news_e/news26_e/gpro_30jan26_276_e.htm
日本外务省.py,"Courtesy Call on State Minister HORII by Mr. Tang, Director General of the World Intellectual Property Organization",https://www.mofa.go.jp/press/release/pressite_000001_02040.html
联合国海洋法庭.py,,
国际海底管理局.py,Ask an Expert: Is 2026 the year for consolidated ocean governance architecture?,https://isa.org.jm/news/ask-an-expert-is-2026-the-year-for-consolidated-ocean-governance-architecture/
战略与国际研究中心.py,"The Impossible State Live Podcast: North Korea in 2026: Intentions, Realities, and Response",https://www.csis.org/events/impossible-state-live-podcast-north-korea-2026-intentions-realities-and-response
美国国务院.py,,
美国运输部海事管理局.py,,
中国海事局.py,,
日本海上保安大学校.py,,
日本海上保安厅.py,,
太平洋岛国论坛.py,,
越南外交部.py,Việt Nam tìm hiểu các cơ hội hợp tác kinh tế và phát triển trung tâm tài chính quốc tế với doanh...,https://mofa.gov.vn/vi/tin-chi-tiet/chi-tiet/viet-nam-tim-hieu-cac-co-hoi-hop-tac-kinh-te-va-phat-trien-trung-tam-tai-chinh-quoc-te-voi-doanh-nghiep-thuy-si-58637-139.html
越南外交学院.py,"Cụ thể hoá nội hàm 'trọng yếu, thường xuyên' và 'tự chủ chiến lược, tự cường' trong văn kiện Đại hội XIV",https://www.dav.edu.vn/cu-the-hoa-noi-ham-trong-yeu-thuong-xuyen-va-tu-chu-chien-luoc-tu-cuong-trong-van-kien-dai-hoi-xiv/
中国国际电视台官微.py,,
南海之声.py,,
